{
    "title": "some title",
    "description": "some description",
    "start_date": "2021-01-20 23:59:59 ",
    "end_date": "2021-01-21 07:00:00 ",
    "venue": "some venue",
    "url": "some url",
    "url_name": "some url name",
    "visibility": "visible",
    "createdts": "2022-11-09 11:56:14 ",
    "updatedts": "2022-11-09 11:56:14 ",
    "id": "636bdbae7b18763522a94293"
}
